{
  "$schema":"https://json-schema.org/draft/2020-12/schema",
  "$id":"appcreate://schemas/post-iteration-review.schema.json",
  "type":"object",
  "required":["schemaVersion","applicability","product","scope","evidence","domains","perspectives","levels","traceability","findings","finalReview","releaseReadiness","productionObservation","claim"],
  "properties":{
    "schemaVersion":{"type":"integer","minimum":2},
    "applicability":{"type":"object","required":["status","reason","approvedBy","evidenceRefs"],"properties":{"status":{"enum":["undetermined","applicable","not_applicable"]},"reason":{"type":["string","null"]},"approvedBy":{"type":["string","null"]},"evidenceRefs":{"type":"array","items":{"type":"string"}}}},
    "product":{"type":"object","required":["ref","auditRef","iterationId","baselineRevision","candidateRevision","observedAt"],"properties":{"ref":{"type":"string","minLength":1},"auditRef":{"type":"string","minLength":1},"iterationId":{"type":"string","minLength":1},"baselineRevision":{"type":"string","minLength":1},"candidateRevision":{"type":"string","minLength":1},"observedAt":{"type":"string","minLength":1}}},
    "scope":{"type":"object","required":["status","selectedRecommendationIds","inScope","outOfScope","changedPages","changedModules","changedJourneys","changedServices","knownRisks"],"properties":{"status":{"enum":["not_started","in_progress","completed"]},"selectedRecommendationIds":{"type":"array","minItems":1,"items":{"type":"string"}},"inScope":{"type":"array","minItems":1,"items":{"type":"string"}},"outOfScope":{"type":"array","items":{"type":"string"}},"changedPages":{"type":"array","items":{"type":"string"}},"changedModules":{"type":"array","items":{"type":"string"}},"changedJourneys":{"type":"array","items":{"type":"string"}},"changedServices":{"type":"array","items":{"type":"string"}},"knownRisks":{"type":"array","items":{"type":"string"}}}},
    "evidence":{"type":"array","items":{"type":"object","required":["id","level","sourceRef","sha256","result","producer","subjectRefs","observedAt","scope","limitations"],"properties":{"id":{"type":"string","minLength":1},"level":{"type":"string","minLength":1},"sourceRef":{"type":"string","minLength":1},"sha256":{"type":"string","pattern":"^sha256:[a-f0-9]{64}$"},"result":{"enum":["passed","approved"]},"producer":{"type":"string","minLength":1},"attestedBy":{"type":"string","minLength":1},"attestationRef":{"type":"string","minLength":1},"attestationSha256":{"type":"string","pattern":"^sha256:[a-f0-9]{64}$"},"subjectRefs":{"type":"array","minItems":1,"items":{"type":"string","minLength":1},"uniqueItems":true},"observedAt":{"type":"string","minLength":1,"format":"date-time"},"scope":{"type":"array","items":{"type":"string"}},"limitations":{"type":"array","items":{"type":"string"}}}}},
    "domains":{"type":"array","items":{"type":"object","required":["id","status","scope","findingIds","evidenceRefs","reviewer","reviewedAt"],"properties":{"id":{"type":"string"},"status":{"enum":["not_started","in_progress","passed","failed","not_applicable"]},"scope":{"type":"array","items":{"type":"string"}},"findingIds":{"type":"array","items":{"type":"string"}},"evidenceRefs":{"type":"array","items":{"type":"string"}},"reviewer":{"type":["string","null"]},"reviewedAt":{"type":["string","null"]},"notApplicable":{"type":"object"}}}},
    "perspectives":{"type":"array","items":{"type":"object","required":["id","status","reviewer","reviewRunRef","independentFromProducer","scope","findingIds","evidenceRefs","reviewedAt"],"properties":{"id":{"type":"string"},"status":{"enum":["not_started","in_progress","passed","failed","not_applicable"]},"reviewer":{"type":["string","null"]},"reviewRunRef":{"type":["string","null"]},"independentFromProducer":{"type":"boolean"},"scope":{"type":"array","items":{"type":"string"}},"findingIds":{"type":"array","items":{"type":"string"}},"evidenceRefs":{"type":"array","items":{"type":"string"}},"reviewedAt":{"type":["string","null"]},"notApplicable":{"type":"object"}}}},
    "levels":{"type":"array","items":{"type":"object","required":["id","status","itemsExpected","itemsReviewed","findingIds","evidenceRefs"],"properties":{"id":{"type":"string"},"status":{"enum":["not_started","in_progress","passed","failed","not_applicable","deferred"]},"itemsExpected":{"type":"array","items":{"type":"string"}},"itemsReviewed":{"type":"array","items":{"type":"string"}},"findingIds":{"type":"array","items":{"type":"string"}},"evidenceRefs":{"type":"array","items":{"type":"string"}},"notApplicable":{"type":"object"},"deferredUntil":{"type":"string"}}}},
    "traceability":{"type":"array","minItems":1,"items":{"type":"object","required":["recommendationId","auditFindingIds","planRefs","implementationRefs","verificationRefs","reviewFindingIds"],"properties":{"recommendationId":{"type":"string"},"auditFindingIds":{"type":"array","minItems":1,"items":{"type":"string"}},"planRefs":{"type":"array","minItems":1,"items":{"type":"string"}},"implementationRefs":{"type":"array","minItems":1,"items":{"type":"string"}},"verificationRefs":{"type":"array","minItems":1,"items":{"type":"string"}},"reviewFindingIds":{"type":"array","items":{"type":"string"}}}}},
    "findings":{"type":"array","items":{"type":"object","required":["id","domains","perspectives","levels","severity","status","statement","rootCause","impact","owner","remediationRefs","regressionEvidenceRefs","residualRisk","independentReviewer"],"properties":{"id":{"type":"string"},"domains":{"type":"array","minItems":1,"items":{"type":"string"}},"perspectives":{"type":"array","minItems":1,"items":{"type":"string"}},"levels":{"type":"array","minItems":1,"items":{"type":"string"}},"severity":{"enum":["critical","high","medium","low"]},"status":{"enum":["open","fixing","fixed_unverified","verified_closed","accepted_risk"]},"statement":{"type":"string","minLength":1},"rootCause":{"type":"string"},"impact":{"type":"string"},"owner":{"type":"string"},"remediationRefs":{"type":"array","items":{"type":"string"}},"regressionEvidenceRefs":{"type":"array","items":{"type":"string"}},"residualRisk":{"type":"string"},"independentReviewer":{"type":["string","null"]},"riskAcceptance":{"type":"object"}}}},
    "finalReview":{"type":"object","required":["producer","finalReviewer","reviewRunRef","decision","evidenceRefs","observedAt"],"properties":{"producer":{"type":"string"},"finalReviewer":{"type":"string"},"reviewRunRef":{"type":["string","null"]},"decision":{"enum":["not_reviewed","needs_fix","approved","approved_with_residual_risk","blocked"]},"evidenceRefs":{"type":"array","items":{"type":"string"}},"observedAt":{"type":"string"}}},
    "releaseReadiness":{"type":"object","required":["status","candidateRef","targetEnvironmentEvidenceRefs","rollbackEvidenceRefs","decision"],"properties":{"status":{"enum":["not_started","in_progress","passed","failed"]},"candidateRef":{"type":"string"},"targetEnvironmentEvidenceRefs":{"type":"array","items":{"type":"string"}},"rollbackEvidenceRefs":{"type":"array","items":{"type":"string"}},"decision":{"type":"string"}}},
    "productionObservation":{"type":"object","required":["status","window","evidenceRefs","metrics"],"properties":{"status":{"enum":["not_started","in_progress","completed"]},"window":{"type":"string"},"evidenceRefs":{"type":"array","items":{"type":"string"}},"metrics":{"type":"array","items":{"type":"object","required":["id","category","status","evidenceRefs"],"properties":{"id":{"type":"string"},"category":{"enum":["product","market-business","reliability-operations"]},"status":{"enum":["not_run","passed","failed","inconclusive"]},"evidenceRefs":{"type":"array","items":{"type":"string"}}}}}}},
    "claim":{"enum":["draft","review-structured","deep-review-complete","release-review-ready","outcome-reviewed"]}
  }
}
