{
  "$schema": "appcreate://schemas/post-iteration-review.schema.json",
  "schemaVersion": 2,
  "applicability": {
    "status": "applicable",
    "reason": "The iteration changes the public installer, Studio runtime and HTTP boundary, website locale roots, CI, product claims and adoption contract.",
    "approvedBy": "product-owner:user",
    "evidenceRefs": ["E-LOCAL"]
  },
  "product": {
    "ref": ".",
    "auditRef": "quality/product-audit-2026-08-30.json",
    "iterationId": "kacha-product-optimization-2026-08-30",
    "baselineRevision": "51e0e782ec2554e0e070a3d3c779a58f55cb48a3",
    "candidateRevision": "working-tree-pre-commit",
    "observedAt": "2026-08-30T14:10:00Z"
  },
  "scope": {
    "status": "completed",
    "selectedRecommendationIds": [
      "KACHA-REC-001", "KACHA-REC-002", "KACHA-REC-003", "KACHA-REC-004",
      "KACHA-REC-005", "KACHA-REC-006", "KACHA-REC-007", "KACHA-REC-008"
    ],
    "inScope": [
      "secure standalone installer and explicit release channels",
      "Studio immutable catalog prewarm and bounded font cache",
      "typed Studio request boundaries and finite timeouts",
      "macOS runner venv",
      "machine-checked current product truth",
      "locale-correct public pages and copy feedback",
      "privacy-conscious adoption measurement",
      "full local verification, push and dual-agent deployment"
    ],
    "outOfScope": [
      "GitHub Release or tag",
      "third-party analytics",
      "vinext major-beta migration",
      "general NLE scope",
      "real creator and business outcome claims",
      "producer self-approval as independent final review"
    ],
    "changedPages": [
      "website /",
      "website /en/",
      "studio /editor"
    ],
    "changedModules": [
      "scripts/install.sh",
      "scripts/design_system.mjs",
      "scripts/kacha_studio.mjs",
      "scripts/kacha_studio_server.mjs",
      "scripts/verify_product_truth.mjs",
      "website/app/components/CopyInstall.tsx",
      "website/app/site-content.ts"
    ],
    "changedJourneys": [
      "official-site-to-channel-install",
      "locale-entry-and-copy-feedback",
      "Studio-startup-and-empty-editor-resize"
    ],
    "changedServices": [
      "Studio GET /api/bootstrap",
      "Studio POST JSON endpoints",
      "raw-GitHub release-channel bootstrap",
      "GitHub macOS smoke and Pages delivery"
    ],
    "knownRisks": [
      "Independent final review has not been performed.",
      "Public remote, macOS, Pages and dual-agent evidence require the final pushed commit.",
      "New system fonts may require a Studio restart.",
      "The development-only vinext advisory is deferred to a separate beta compatibility iteration.",
      "No real creator project or outcome cohort was observed."
    ]
  },
  "evidence": [
    {
      "id": "E-LOCAL",
      "level": "E2-source-or-local-check",
      "sourceRef": "quality/evidence/product-optimization-local-verification-2026-08-30.json",
      "sha256": "sha256:99e69a0918a2242b7700b1eba837d5c1deb4e37d3d0e5703c3db13d6e8f028b0",
      "result": "passed",
      "producer": "codex-primary",
      "subjectRefs": [
        "recommendation:KACHA-REC-001", "recommendation:KACHA-REC-002",
        "recommendation:KACHA-REC-003", "recommendation:KACHA-REC-004",
        "recommendation:KACHA-REC-005", "recommendation:KACHA-REC-006",
        "recommendation:KACHA-REC-007", "recommendation:KACHA-REC-008",
        "finding:R-OPT-001", "finding:R-OPT-002", "finding:R-OPT-003",
        "finding:R-OPT-004", "finding:R-OPT-005", "finding:R-OPT-006",
        "finding:R-OPT-007", "finding:R-OPT-008", "finding:R-OPT-009",
        "finding:R-OPT-010", "finding:R-OPT-011", "finding:R-OPT-012",
        "finding:R-OPT-013"
      ],
      "observedAt": "2026-08-30T14:05:00Z",
      "scope": ["local source", "159-test regression", "installer", "website builds", "real loopback browser", "host-specific performance"],
      "limitations": ["Producer-generated", "No pushed target environment", "No independent final review", "No creator or business outcome"]
    }
  ],
  "domains": [
    {"id":"product-direction","status":"in_progress","scope":["positioning and current product truth"],"findingIds":["R-OPT-005"],"evidenceRefs":[],"reviewer":"codex-primary","reviewedAt":"2026-08-30T14:10:00Z"},
    {"id":"product-design","status":"in_progress","scope":["public activation journey"],"findingIds":["R-OPT-001"],"evidenceRefs":[],"reviewer":"codex-primary","reviewedAt":"2026-08-30T14:10:00Z"},
    {"id":"ui-design","status":"in_progress","scope":["Studio empty and responsive state"],"findingIds":["R-OPT-010"],"evidenceRefs":[],"reviewer":"codex-primary","reviewedAt":"2026-08-30T14:10:00Z"},
    {"id":"interaction-journeys","status":"in_progress","scope":["copy completion feedback"],"findingIds":["R-OPT-009"],"evidenceRefs":[],"reviewer":"codex-primary","reviewedAt":"2026-08-30T14:10:00Z"},
    {"id":"business-logic","status":"in_progress","scope":["release and renderer truth boundaries"],"findingIds":[],"evidenceRefs":[],"reviewer":"codex-primary","reviewedAt":"2026-08-30T14:10:00Z"},
    {"id":"data-api","status":"in_progress","scope":["Studio JSON contract"],"findingIds":["R-OPT-004"],"evidenceRefs":[],"reviewer":"codex-primary","reviewedAt":"2026-08-30T14:10:00Z"},
    {"id":"code-architecture","status":"in_progress","scope":["catalog and font cache boundaries"],"findingIds":["R-OPT-012"],"evidenceRefs":[],"reviewer":"codex-primary","reviewedAt":"2026-08-30T14:10:00Z"},
    {"id":"code-implementation","status":"in_progress","scope":["design artifact invalidation"],"findingIds":["R-OPT-011"],"evidenceRefs":[],"reviewer":"codex-primary","reviewedAt":"2026-08-30T14:10:00Z"},
    {"id":"security-privacy-compliance","status":"in_progress","scope":["installer refs, dependencies and local HTTP"],"findingIds":["R-OPT-013"],"evidenceRefs":[],"reviewer":"codex-primary","reviewedAt":"2026-08-30T14:10:00Z"},
    {"id":"accessibility-inclusion","status":"in_progress","scope":["document language and live feedback"],"findingIds":["R-OPT-006"],"evidenceRefs":[],"reviewer":"codex-primary","reviewedAt":"2026-08-30T14:10:00Z"},
    {"id":"performance-reliability","status":"in_progress","scope":["Studio startup and cache isolation"],"findingIds":["R-OPT-003"],"evidenceRefs":[],"reviewer":"codex-primary","reviewedAt":"2026-08-30T14:10:00Z"},
    {"id":"test-quality","status":"in_progress","scope":["159 regressions and negative boundaries"],"findingIds":[],"evidenceRefs":[],"reviewer":"codex-primary","reviewedAt":"2026-08-30T14:10:00Z"},
    {"id":"deployment-operations","status":"in_progress","scope":["macOS, Pages and dual-agent delivery"],"findingIds":["R-OPT-002"],"evidenceRefs":[],"reviewer":"codex-primary","reviewedAt":"2026-08-30T14:10:00Z"},
    {"id":"market-operations","status":"in_progress","scope":["channel messaging and adoption measurement"],"findingIds":["R-OPT-007","R-OPT-008"],"evidenceRefs":[],"reviewer":"codex-primary","reviewedAt":"2026-08-30T14:10:00Z"}
  ],
  "perspectives": [
    {"id":"product","status":"in_progress","reviewer":"codex-primary","reviewRunRef":null,"independentFromProducer":false,"scope":["product truth"],"findingIds":["R-OPT-005"],"evidenceRefs":[],"reviewedAt":"2026-08-30T14:10:00Z"},
    {"id":"design","status":"in_progress","reviewer":"codex-primary","reviewRunRef":null,"independentFromProducer":false,"scope":["locale structure"],"findingIds":["R-OPT-006"],"evidenceRefs":[],"reviewedAt":"2026-08-30T14:10:00Z"},
    {"id":"engineering","status":"in_progress","reviewer":"codex-primary","reviewRunRef":null,"independentFromProducer":false,"scope":["installer and runtime"],"findingIds":["R-OPT-001","R-OPT-003","R-OPT-012"],"evidenceRefs":[],"reviewedAt":"2026-08-30T14:10:00Z"},
    {"id":"quality","status":"in_progress","reviewer":"codex-primary","reviewRunRef":null,"independentFromProducer":false,"scope":["browser and artifact regressions"],"findingIds":["R-OPT-009","R-OPT-010","R-OPT-011"],"evidenceRefs":[],"reviewedAt":"2026-08-30T14:10:00Z"},
    {"id":"security-privacy","status":"in_progress","reviewer":"codex-primary","reviewRunRef":null,"independentFromProducer":false,"scope":["HTTP and dependency boundaries"],"findingIds":["R-OPT-004","R-OPT-013"],"evidenceRefs":[],"reviewedAt":"2026-08-30T14:10:00Z"},
    {"id":"sre-operations","status":"in_progress","reviewer":"codex-primary","reviewRunRef":null,"independentFromProducer":false,"scope":["macOS and local deployment"],"findingIds":["R-OPT-002"],"evidenceRefs":[],"reviewedAt":"2026-08-30T14:10:00Z"},
    {"id":"data-analytics","status":"in_progress","reviewer":"codex-primary","reviewRunRef":null,"independentFromProducer":false,"scope":["adoption contract"],"findingIds":["R-OPT-008"],"evidenceRefs":[],"reviewedAt":"2026-08-30T14:10:00Z"},
    {"id":"market-growth","status":"in_progress","reviewer":"codex-primary","reviewRunRef":null,"independentFromProducer":false,"scope":["acquisition channel"],"findingIds":["R-OPT-007"],"evidenceRefs":[],"reviewedAt":"2026-08-30T14:10:00Z"},
    {"id":"independent-final-review","status":"not_started","reviewer":null,"reviewRunRef":null,"independentFromProducer":true,"scope":["whole iteration"],"findingIds":[],"evidenceRefs":[],"reviewedAt":null}
  ],
  "levels": [
    {"id":"artifact","status":"in_progress","itemsExpected":["source and evidence artifacts"],"itemsReviewed":["source and evidence artifacts"],"findingIds":["R-OPT-005","R-OPT-011"],"evidenceRefs":[]},